{
  "version": "2.0",
  "resumen": {
    "encuestas": 255,
    "carreras": 5,
    "facultades": 3,
    "fecha_inicio": "2026-04-16",
    "fecha_fin": "2026-05-15",
    "dias": 29,
    "dias_recoleccion": 6,
    "año": 2026,
    "periodo": "2026",
    "nps": {
      "score": 85.88,
      "promotores": 224,
      "pasivos": 26,
      "detractores": 5,
      "total": 255
    },
    "csat": {
      "score": 99.22,
      "t3b": 253,
      "total": 255
    },
    "empleabilidad": {
      "score": 85.49,
      "empleados": 218,
      "total": 255
    }
  },
  "hallazgos": {
    "csat_pct": 99,
    "nps_score": 85,
    "nps_tipo": "Excelente",
    "nps_etapas": {},
    "tendencia": "se mantiene",
    "delta": 0,
    "top_dimensiones": [
      {
        "name": "Habilidades para aportar nuevas ideas",
        "score": 100.0
      },
      {
        "name": "Calidad de la formación académica",
        "score": 99.61
      }
    ],
    "top_facultades": [
      {
        "name": "Facultad de Ingeniería",
        "score": 100.0
      },
      {
        "name": "Facultad de Comunicación",
        "score": 98.85
      }
    ]
  },
  "nps": {
    "promotores": 224,
    "pasivos": 26,
    "detractores": 5,
    "score": 85.88
  },
  "csat": {
    "Totalmente satisfecho": 151,
    "Muy satisfecho": 55,
    "Satisfecho": 47,
    "Insatisfecho": 2,
    "Totalmente insatisfecho": 0,
    "No utilizo": 0,
    "No conozco": 0
  }
}